{
  "version": "1",
  "agreement": "example",
  "milestone": 0,
  "criteria": [
    {
      "id": "AC-1",
      "tier": 1,
      "desc": "GET /health returns 200",
      "test": "health"
    },
    {
      "id": "AC-2",
      "tier": 1,
      "desc": "POST /items creates item",
      "test": "create item"
    },
    {
      "id": "AC-3",
      "tier": 1,
      "desc": "POST /items rejects missing name",
      "test": "rejects missing name"
    },
    {
      "id": "AC-4",
      "tier": 1,
      "desc": "GET /items/:id returns item",
      "test": "get item"
    },
    {
      "id": "AC-5",
      "tier": 1,
      "desc": "GET /items/:id 404 on unknown",
      "test": "404 unknown"
    }
  ],
  "trigger": "all_tier1_pass",
  "testSuiteHash": "0xc46ee331be25212a285e6de5289bd7aa29d5bc24b66b03e6234e761a2e5fe9b9"
}
